{"schema":"flowcast.live/v1","id":"USGS-01654000","slug":"accotink","generated":"2021-06-29T12:30:00Z","status":"active","always_on":true,"always_on_reasons":["pinned"],"awake_until":null,"forecast":{"issue":"2021062912","issue_time":"2021-06-29T12:00:00Z","url":"/data/v1/sites/USGS-01654000/forecasts/2021062912.json","age_h":0.5},"recent_forecasts":[{"issue":"2021062912","issue_time":"2021-06-29T12:00:00Z","url":"/data/v1/sites/USGS-01654000/forecasts/2021062912.json","age_h":0.5}],"static_url":"/data/v1/sites/USGS-01654000/static.json","now":{"observed_at":"2021-06-29T12:00:00Z","flow_cfs":6.747,"flow_change_24h_cfs":0,"stage_ft":null,"water_temp_c":25.1,"gauge_stale":false,"flood_category":null},"observations":{"discharge":{"unit":"ft3/s","start":"2021-05-30T12:00:00Z","step_h":1,"values":[29.5,25.32,23.2,21.4,19.02,18.2,17.7,16.95,15.52,15.97,14.4,13.72,13.1,11.62,11.62,11.27,11.8,11.45,10.87,11.45,11.27,11.27,10.5,9.595,9.767,9.595,8.735,9.417,8.9,9.072,8.9,8.742,9.245,9.072,8.24,9.417,9.245,8.405,8.082,8.405,6.87,7.31,7.46,7.46,7.925,7.01,7.01,6.865,6.865,15.15,20.57,16.57,9.605,8.405,7.46,7.46,7.61,7.767,7.61,7.767,7.61,7.31,6.72,6.43,6.16,6.865,6.575,7.172,7.172,7.46,6.72,6.72,8.435,6.87,6.43,6.43,6.16,6.43,6.16,5.76,5.247,1.372,0.465,0.7375,1.52,2.345,3.787,5.125,5.125,4.88,5.63,5.5,5.63,5.89,5.89,5.5,6.992,14.17,14.85,13.72,11.7,8.907,6.187,1.46,0.355,0.51,1.487,5.03,8.117,8.24,7.61,7.16,7.01,6.575,6.43,6.295,5.76,5.89,5.89,5.37,8.887,17.45,14.85,12.5,11.1,5.232,1.29,0.835,1.84,115,89.77,67.97,58,43.75,35.62,27.92,21.42,19.27,16.02,14.85,12.27,11.62,10.37,9.245,10.12,12.67,10.32,9.595,4.04,3.615,5.385,6.865,6.72,6.025,6.305,6.305,5.37,5.37,5.125,5.125,5.002,4.88,4.65,4.765,4.765,4.88,4.535,4.535,4.42,4.765,4.42,4.42,4.88,4.2,4.09,4.535,4.31,3.98,3.98,3.98,3.98,4.42,3.98,3.98,4.42,3.98,4.31,4.42,4.42,4.31,3.98,3.877,7.285,19.27,18.5,6.745,4.765,4.31,4.42,3.257,0.725,0.275,0.3075,0.51,0.975,1.772,2.745,3.375,3.57,3.775,3.98,3.877,3.775,3.775,4.2,6.47,16,null,11.43,7.16,7.01,7.01,5.24,1.487,0.715,1.08,1.7,2.417,3.787,5.377,7.757,16.82,18.25,13.97,11.45,9.945,9.072,8.405,8.082,7.767,13.28,20.32,19.27,12.7,2.967,0.93,0.93,1.52,2.185,3.697,5.507,6.295,6.72,6.72,7.01,7.01,7.01,7.01,7.01,7.01,6.865,7.01,7.01,6.72,6.72,6.575,6.43,6.43,6.575,6.43,6.43,6.43,8.067,572.5,562.5,762.2,604.2,307.7,220.7,200,176.5,152.5,142,141.7,131.7,125.5,118.5,136.5,205.2,195.5,332,585.5,516.2,374.7,320.2,321,237.5,168.7,129.2,106.2,88.5,76.87,67.62,63.05,58.45,53.57,49.8,45.77,41.5,38.3,36.37,34.87,33,31.25,29.85,28.8,27.17,26.2,25.3,24.1,23.2,22.6,22,21.4,20.85,19.55,19.02,18.47,18.2,17.7,16.95,17.2,16.45,15.97,15.3,15.07,15.07,15.3,14.85,14.62,14.4,13.5,13.72,13.5,13.3,13.3,12.9,12.7,12.7,12.7,12.7,13.95,14.62,15.52,16.2,15.97,15.07,14.85,13.72,13.1,12.9,12.7,12.7,12.02,11.8,11.27,11.1,11.27,11.1,10.5,10.3,10.5,10.3,10.5,10.3,205.7,1036,1137,1242,1595,1817,935.2,271.2,173.7,138.7,117.2,101.5,89.42,78.87,73.17,67.9,63.62,61.1,58.7,55.8,52.22,48.35,45.1,42.4,39.37,37.7,36.1,33.3,32.55,30.67,28.9,27.15,26.1,25.45,24.5,23.27,23.27,22,21.1,20.27,19.1,18.3,18.05,17.8,16.7,16.97,17.25,18.02,18.02,17.25,16.7,15.7,14.47,14.02,13.35,13.12,12.9,12.22,12.45,13.35,13.57,12.9,12,12,11.8,11.4,11.2,11,10.4,10.4,10.4,10.4,10.4,10.4,10.4,10.4,10.2,10.2,9.815,9.815,9.62,9.62,9.62,9.62,9.395,9.507,9.17,9.17,9.17,9.17,9.17,9.17,9.06,8.84,8.84,8.73,8.84,8.73,8.73,8.73,8.73,8.73,8.73,8.73,8.73,8.73,8.52,8.52,8.73,8.73,8.73,8.73,8.625,8.52,8.415,8.415,8.415,8.31,8.31,8.31,8.31,9.042,9.897,8.84,8.73,8.625,8.52,8.73,9.68,12.67,14.47,15.7,15.2,14.02,24.9,23.57,18.35,15.45,13.35,12.22,10.8,10.01,9.62,9.17,8.73,8.73,8.415,8.31,7.995,7.89,7.89,7.89,7.69,7.79,7.49,7.59,7.79,7.89,7.89,7.89,7.59,7.49,7.49,7.49,7.49,7.392,7.392,7.1,7.1,7.1,7.197,7.49,7.49,7.49,7.295,7.1,7.1,7.1,7.1,7.1,7.1,8,21.77,37.07,35.4,76.5,130.7,101,76.62,63.07,52.3,40.67,32.97,26.82,22.65,19.15,16.47,14.5,13.35,11.6,10.8,10.2,11.2,9.06,8.84,8.625,7.627,7.505,8.112,7.59,7.59,7.49,7.392,7.197,7.295,7.197,7.1,6.91,7.005,6.91,6.72,6.72,6.627,6.72,6.442,7.1,7.812,6.627,6.535,6.442,6.535,6.627,6.72,6.35,5.62,5.635,6.35,6.35,6.35,6.262,6.087,6,6,6,6,6.087,6,6,6.372,7.112,6.175,6,6.262,6.262,6.262,5.467,5.42,6.175,6.35,6.35,6.35,6.175,6.262,6.35,6.35,6.35,6.262,6.35,6.175,6.087,6.262,6.35,6.175,6.35,6.087,6.087,6.087,6.35,6.35,6.35,6.35,6.262,6.35,6.35,6.175,6.35,6.175,6,6.175,6.087,6.087,6.175,6.175,6,6.35,6.262,6.35,6.35,6.35,6.35,6.35,6.262,6.35,6.175,6.35,6.175,6,6.087,6,6,6,6,6,6,5.745,5.83,5.66,5.745,5.66,5.66,5.925,6.817,5.745,5.66,5.66,5.66,5.66,5.66,5.412,4.877,4.397,5.66,5.66,5.66,5.577,5.577,5.66,5.577,5.66,5.577,5.33,5.33,5.33,5.33,5.677,6.747]},"water_temperature":{"unit":"degC","start":"2021-05-30T12:00:00Z","step_h":1,"values":[14.85,14.8,14.8,14.88,14.9,14.9,14.95,15.07,15.15,15.23,15.25,15.2,15.1,15.02,14.98,14.9,14.77,14.65,14.52,14.38,14.25,14.12,14,13.88,13.8,13.93,14.18,14.7,15.3,15.8,16.42,17.23,17.75,17.98,17.9,17.62,17.42,17.3,17.3,17.2,17.12,16.95,16.83,16.67,16.55,16.42,16.25,16.05,16,16.02,16.15,16.45,17.02,17.9,18.88,19.6,20.2,20.38,20.25,20.1,19.9,19.7,19.5,19.35,19.23,19.1,19.05,18.95,18.83,18.65,18.45,18.3,18.2,18.15,18.27,18.65,19.12,19.83,20.85,21.75,22.17,22.45,22.5,22.45,22.25,21.75,21.38,21.08,20.9,20.83,20.75,20.65,20.58,20.5,20.42,20.4,20.4,20.4,20.4,20.42,20.65,21.27,21.9,22.35,22.95,23.33,23.52,23.15,22.65,22.3,22.1,21.98,21.88,21.8,21.73,21.7,21.62,21.58,21.45,21.33,21.23,21.17,21.1,21.25,21.73,22.08,22.42,23.4,24.25,24.17,23.27,22.88,22.73,22.62,22.45,22.25,22.05,21.9,21.7,21.52,21.35,21.17,21,20.85,20.8,20.9,21.12,21.55,22.23,23.08,24.08,24.73,25.08,25.08,24.9,24.55,24.23,23.95,23.77,23.65,23.52,23.35,23.2,23,22.83,22.65,22.5,22.33,22.27,22.33,22.55,23.05,23.8,24.6,25.35,25.85,26.17,26.1,25.9,25.65,25.25,24.95,24.75,24.62,24.55,24.48,24.38,24.27,24.15,23.98,23.85,23.75,23.7,23.85,24.02,24.23,24.73,25.52,26.1,26.6,27.17,27.5,27.65,27.8,27.52,26.92,26.38,26.05,25.8,25.62,25.52,25.42,25.27,25.15,24.98,24.85,24.8,24.9,24.8,24.9,25.25,25.88,26.3,26.75,27.17,27.48,27.62,27.77,27.4,26.95,26.52,26.2,26.05,25.98,25.83,25.65,25.48,25.2,24.92,24.75,24.7,24.73,24.7,24.7,24.7,24.98,25.27,25.7,26.12,26.48,26.52,26.17,25.85,25.6,25.38,25.17,25.05,24.92,24.83,24.75,24.62,24.48,24.35,24.23,24.2,24.3,24.42,24.67,25.1,25.6,26.17,26.62,26.92,26.4,25.62,25.12,25.38,25.12,24.9,24.65,24.42,24.2,23.95,23.7,23.45,23.2,23,22.85,22.58,22.23,21.98,21.88,21.75,21.77,21.8,21.73,21.7,21.77,21.73,21.67,21.6,21.52,21.48,21.4,21.33,21.25,21.15,21.08,20.98,20.88,20.77,20.67,20.6,20.55,20.5,20.55,20.65,20.8,20.88,21.08,21.42,21.67,21.73,21.62,21.5,21.5,21.42,21.27,21.17,21.1,21.02,20.88,20.75,20.6,20.48,20.4,20.4,20.52,20.75,21.08,21.65,22.17,22.45,22.35,22.23,22.45,22.67,22.6,22.52,22.4,22.3,22.3,22.2,22.15,22,21.85,21.65,21.45,21.3,21.12,21,21.05,21.3,21.67,22.1,22.9,23.73,24.35,24.52,24.6,24.5,24.27,24,23.85,23.8,23.73,22.17,21.08,20.83,20.6,20.52,20.5,20.5,20.35,20.3,20.3,20.38,20.6,21,21.5,22,22.55,22.77,22.75,22.75,22.55,22.35,22.15,21.95,21.8,21.6,21.45,21.33,21.17,21.05,20.9,20.75,20.58,20.45,20.4,20.4,20.6,21.05,21.62,22.25,22.83,23.15,23.27,23.1,22.85,22.6,22.45,22.23,21.98,21.7,21.45,21.2,20.95,20.65,20.33,20.02,19.75,19.58,19.5,19.6,19.95,20.48,21.17,21.85,22.4,22.67,22.7,22.5,22.17,21.88,21.65,21.45,21.3,21.08,20.8,20.6,20.35,20.15,19.9,19.67,19.4,19.23,19.2,19.35,19.73,20.38,21.12,21.92,22.48,22.67,22.6,22.5,22.4,22.25,22.17,22.1,22.1,22.08,22,21.92,21.85,21.8,21.73,21.62,21.5,21.45,21.4,21.4,21.38,21.4,21.45,21.73,22.4,22.75,22.75,22.52,22.48,22.35,22.25,22.2,22.12,22.1,21.95,21.9,21.92,21.9,21.8,21.73,21.67,21.7,21.83,21.95,22.27,22.77,23.4,24.4,25.25,25.5,25.48,25.35,25.17,24.95,24.75,24.65,24.52,24.42,24.27,24.12,23.98,23.85,23.75,23.65,23.6,23.6,23.65,23.8,24.15,24.77,25.45,26.2,26.8,27.08,27.1,26.67,26.2,25.95,25.83,25.7,25.6,25.5,25.38,25.2,25,24.8,24.62,24.45,24.35,24.27,24.15,23.98,23.8,23.6,23.1,22.52,22.95,22.75,22.17,21.95,21.95,21.73,21.5,21.3,21.1,20.88,20.62,20.4,20.17,19.92,19.7,19.45,19.25,19.1,19.1,19.25,19.58,20.15,20.83,21.6,22.2,22.42,22.6,22.52,22.15,21.75,21.4,21.15,20.95,20.8,20.65,20.45,20.25,20,19.8,19.6,19.45,19.35,19.42,19.67,20.08,20.73,21.25,21.55,21.95,22.35,22.38,22.23,22.02,21.6,21.25,20.98,20.75,20.58,20.45,20.35,20.17,20.02,19.85,19.67,19.58,19.52,19.65,19.9,20.2,20.9,21.67,22.38,22.92,23.35,23.27,23.08,22.77,22.42,22.1,21.95,21.9,21.83,21.8,21.8,21.8,21.8,21.73,21.7,21.7,21.7,21.83,21.98,22.17,22.5,23.3,24.02,24.42,24.62,24.55,24.38,24.2,24.02,23.85,23.73,23.6,23.52,23.42,23.33,23.25,23.15,23.05,23,22.9,22.98,23.1,23.3,23.67,24.23,24.75,25.27,25.7,26.02,26.1,26.05,25.75,25.42,25.15,24.95,24.83,24.73,24.7,24.6,24.55,24.45,24.35,24.25,24.12,24.1,24.15,24.33,24.83,25.58,26.4,27.1,27.7,28.12,28.17,28.12,27.67,27.15,26.77,26.52,26.35,26.2,26.08,25.95,25.83,25.67,25.5,25.35,25.15,25.1]}}}