{
 "schema": "flowcast.live/v1",
 "id": "USGS-01427510",
 "slug": "callicoon",
 "generated": "2026-10-04T03:25:00Z",
 "status": "active",
 "always_on": true,
 "always_on_reasons": [
  "pinned"
 ],
 "awake_until": null,
 "forecast": {
  "issue": "2026100400",
  "issue_time": "2026-10-04T00:00:00Z",
  "url": "/data/v1/sites/USGS-01427510/forecasts/2026100400.json",
  "age_h": 3.0
 },
 "recent_forecasts": [
  {
   "issue": "2026100400",
   "issue_time": "2026-10-04T00:00:00Z",
   "url": "/data/v1/sites/USGS-01427510/forecasts/2026100400.json",
   "age_h": 3.0
  }
 ],
 "static_url": "/data/v1/sites/USGS-01427510/static.json",
 "now": {
  "observed_at": "2026-10-04T03:00:00Z",
  "flow_cfs": 978.0,
  "flow_change_24h_cfs": -122.0,
  "stage_ft": 3.21,
  "water_temp_c": 17.1,
  "gauge_stale": false,
  "flood_category": "none"
 },
 "observations": {
  "discharge": {
   "unit": "ft3/s",
   "start": "2026-10-01T00:00:00Z",
   "step_h": 1,
   "values": [
    1400.0,
    1400.0,
    1380.0,
    1380.0,
    1380.0,
    1380.0,
    1360.0,
    1360.0,
    1360.0,
    1360.0,
    1360.0,
    1340.0,
    1340.0,
    1340.0,
    1340.0,
    1320.0,
    1320.0,
    1320.0,
    1320.0,
    1320.0,
    1320.0,
    1320.0,
    1320.0,
    1300.0,
    1300.0,
    1280.0,
    1280.0,
    1260.0,
    1240.0,
    1240.0,
    1220.0,
    1220.0,
    1220.0,
    1220.0,
    1210.0,
    1210.0,
    1210.0,
    1190.0,
    1190.0,
    1190.0,
    1170.0,
    1170.0,
    1170.0,
    1150.0,
    1150.0,
    1150.0,
    1150.0,
    1150.0,
    1130.0,
    1130.0,
    1120.0,
    1100.0,
    1100.0,
    1080.0,
    1060.0,
    1060.0,
    1050.0,
    1050.0,
    1030.0,
    1050.0,
    1030.0,
    1050.0,
    1030.0,
    1030.0,
    1030.0,
    1030.0,
    1030.0,
    1030.0,
    1030.0,
    1030.0,
    1010.0,
    1010.0,
    1010.0,
    995.0,
    995.0,
    978.0
   ]
  },
  "water_temperature": {
   "unit": "degC",
   "start": "2026-10-01T00:00:00Z",
   "step_h": 1,
   "values": [
    16.5,
    16.5,
    16.4,
    16.2,
    16.1,
    16.0,
    15.9,
    15.8,
    15.7,
    15.6,
    15.6,
    15.5,
    15.5,
    15.5,
    15.6,
    15.7,
    15.9,
    16.0,
    16.1,
    16.2,
    16.3,
    16.4,
    16.4,
    16.3,
    16.2,
    16.2,
    16.1,
    16.1,
    16.0,
    16.0,
    15.9,
    15.9,
    15.8,
    15.8,
    15.7,
    15.7,
    15.7,
    15.9,
    16.6,
    17.5,
    17.7,
    17.9,
    18.0,
    18.2,
    18.1,
    18.1,
    18.1,
    18.0,
    17.8,
    17.6,
    17.4,
    17.2,
    17.0,
    16.8,
    16.5,
    16.3,
    16.0,
    15.7,
    15.5,
    15.2,
    15.1,
    15.6,
    16.4,
    17.2,
    17.2,
    17.0,
    17.1,
    17.3,
    17.5,
    17.5,
    17.6,
    17.8,
    17.7,
    17.6,
    17.4,
    17.1
   ]
  },
  "stage": {
   "unit": "ft",
   "start": "2026-10-01T00:00:00Z",
   "step_h": 1,
   "values": [
    3.44,
    3.44,
    3.43,
    3.43,
    3.43,
    3.43,
    3.42,
    3.42,
    3.42,
    3.42,
    3.42,
    3.41,
    3.41,
    3.41,
    3.41,
    3.4,
    3.4,
    3.4,
    3.4,
    3.4,
    3.4,
    3.4,
    3.4,
    3.39,
    3.39,
    3.38,
    3.38,
    3.37,
    3.36,
    3.36,
    3.35,
    3.35,
    3.35,
    3.35,
    3.34,
    3.34,
    3.34,
    3.33,
    3.33,
    3.33,
    3.32,
    3.32,
    3.32,
    3.31,
    3.31,
    3.31,
    3.31,
    3.31,
    3.3,
    3.3,
    3.29,
    3.28,
    3.28,
    3.27,
    3.26,
    3.26,
    3.25,
    3.25,
    3.24,
    3.25,
    3.24,
    3.25,
    3.24,
    3.24,
    3.24,
    3.24,
    3.24,
    3.24,
    3.24,
    3.24,
    3.23,
    3.23,
    3.23,
    3.22,
    3.22,
    3.21
   ]
  }
 },
 "freshness": {
  "observations": "2026-10-04T03:00:00Z",
  "hrrr": "2026-10-03T23:00:00Z",
  "mrms": "2026-10-03T23:00:00Z",
  "gefs_init": "2026-10-03T00:00:00Z",
  "snodas": "2026-10-03"
 }
}
