{"schema":"flowcast.live/v1","id":"USGS-01011000","slug":"allagash","generated":"2021-06-29T12:30:00Z","status":"active","always_on":true,"always_on_reasons":["pinned"],"awake_until":null,"forecast":{"issue":"2021062912","issue_time":"2021-06-29T12:00:00Z","url":"/data/v1/sites/USGS-01011000/forecasts/2021062912.json","age_h":0.5},"recent_forecasts":[{"issue":"2021062912","issue_time":"2021-06-29T12:00:00Z","url":"/data/v1/sites/USGS-01011000/forecasts/2021062912.json","age_h":0.5}],"static_url":"/data/v1/sites/USGS-01011000/static.json","now":{"observed_at":"2021-06-29T12:00:00Z","flow_cfs":652,"flow_change_24h_cfs":-30,"stage_ft":null,"water_temp_c":null,"gauge_stale":false,"flood_category":null},"observations":{"discharge":{"unit":"ft3/s","start":"2021-05-30T12:00:00Z","step_h":1,"values":[1410,1402,1400,1390,1382,1370,1367,1357,1355,1352,1350,1340,1340,1340,1320,1325,1320,1320,1330,1335,1342,1350,1350,1350,1357,1360,1365,1370,1375,1380,1390,1407,1415,1432,1460,1477,1507,1530,1555,1585,1605,1637,1667,1692,1715,1742,1755,1777,1795,1815,1825,1830,1850,1857,1862,1870,1870,1867,1862,1865,1860,1860,1850,1840,1830,1820,1810,1800,1797,1790,1780,1765,1757,1750,1745,1735,1720,1710,1710,1687,1682,1672,1665,1655,1640,1632,1625,1610,1602,1597,1590,1587,1580,1560,1552,1547,1540,1535,1517,1510,1502,1500,1485,1477,1475,1490,1480,1470,1470,1467,1460,1460,1457,1450,1450,1445,1430,1430,1420,1420,1417,1410,1410,1407,1402,1402,1400,1380,1380,1372,1370,1365,1360,1352,1347,1340,1335,1320,1315,1310,1305,1300,1295,1290,1282,1280,1260,1257,1252,1250,1247,1240,1240,1240,1237,1250,1252,1297,1302,1295,1292,1300,1310,1345,1350,1355,1357,1360,1360,1360,1372,1390,1415,1427,1445,1457,1460,1470,1470,1470,1470,1467,1462,1460,1455,1445,1430,1425,1417,1410,1400,1390,1377,1370,1362,1352,1345,1335,1330,1310,1302,1290,1285,1265,1252,1247,1235,1230,1222,1210,1210,1190,1187,1180,1175,1170,1162,1152,1150,1140,1132,1130,1110,1107,1100,1090,1087,1080,1072,1070,1070,1062,1052,1047,1040,1040,1035,1030,1020,1010,1000,1000,997,991.2,985.7,983,974.7,972,962,959.2,953.7,946,941,932.7,927.5,920,917.5,907.5,900,900,891.7,889,881.5,879,869,864,859,854,849,841.5,839,826.7,820,812.5,810,802.5,800,800,795,790,787.7,781,781,778.5,773.5,771,771,762,762,759.5,752,749.7,743,743,740.7,740.7,734,734,734,734,734,731.5,724,724,724,724,724,724,724,724,724,724,719.5,715,715,712.7,708.2,703.7,706,701.5,699.2,697,697,687,687,687,680.2,678,673.5,669,669,669,667,663,661,661,661,661,654.2,652,652,652,645.2,643,643,640.7,638.5,634,634,627.2,625,625,625,625,625,619,617,617,617,617,617,614.7,617,610.2,608,605.7,608,608,608,608,608,608,608,608,610.2,614.7,617,617,617,617,617,610.2,614.7,617,617,617,617,617,617,617,621,623,625,625,629.5,634,640.7,652,658.7,661,669,680.2,692,703.7,708.2,717.2,729,750,773.7,800,826.7,851.5,871.5,884,897.2,907.5,910,917.5,912.5,912.5,917.5,910,907.5,900,900,889,886.5,879,869,866.5,859,849,839,839,829,820,815,810,802.5,797.5,790,783.2,776,771,764.2,762,752,745.2,743,734,734,731.5,724,724,715,715,715,710.5,706,706,699.2,697,692,687,684.7,678,675.7,669,669,663,663,661,661,661,656.5,652,652,652,652,652,652,652,645.2,643,643,643,643,640.7,634,634,634,629.5,634,634,627.2,625,625,617,617,617,617,614.7,610.2,612.5,608,608,608,608,608,608,603.5,608,601.2,599,599,599,599,591,591,591,584.2,582,582,582,578,574,574,574,570,566,566,566,560,562,566,574,580,574,574,580,593,599,597,593,591,591,591,591,599,599,605.7,608,608,638.7,652,638.5,634,645.2,652,652,658.7,661,661,661,661,661,661,669,669,675.7,678,678,684.7,687,687,680.2,678,673.5,671.2,669,667,663,656.5,654.2,649.7,643,640.7,634,629.5,625,619,617,608,608,599,599,597,591,591,584.2,582,582,582,576,574,570,568,566,560,554,554,550,550,550,550,546,544,542,542,542,542,542,542,542,542,540,534,534,534,534,532,532,526,526,526,526,526,526,526,526,526,526,526,526,526,522,518,518,518,518,516,514,510,510,510,510,510,510,510,510,518,520,526,526,526,526,532,534,540,542,544,548,550,550,558,558,562,566,566,572,574,574,578,582,582,588.7,591,599.5,629.5,634,634,640.7,649.7,661,667,673.5,682.5,687,689.5,687,687,692,697,697,706,706,712.7,715,715,715,708.2,706,699.2,694.5,687,678,675.7,669,663,658.7,652]},"water_temperature":{"unit":"degC","start":"2021-05-30T12:00:00Z","step_h":1,"values":[null,null,null,null,null,null,null,null,null,null,null,null,null,null,null,null,null,null,null,null,null,null,null,null,null,null,null,null,null,null,null,null,null,null,null,null,null,null,null,null,null,null,null,null,null,null,null,null,null,null,null,null,null,null,null,null,null,null,null,null,null,null,null,null,null,null,null,null,null,null,null,null,null,null,null,null,null,null,null,null,null,null,null,null,null,null,null,null,null,null,null,null,null,null,null,null,null,null,null,null,null,null,null,null,null,null,null,null,null,null,null,null,null,null,null,null,null,null,null,null,null,null,null,null,null,null,null,null,null,null,null,null,null,null,null,null,null,null,null,null,null,null,null,null,null,null,null,null,null,null,null,null,null,null,null,null,null,null,null,null,null,null,null,null,null,null,null,null,null,null,null,null,null,null,null,null,null,null,null,null,null,null,null,null,null,null,null,null,null,null,null,null,null,null,null,null,null,null,null,null,null,null,null,null,null,null,null,null,null,null,null,null,null,null,null,null,null,null,null,null,null,null,null,null,null,null,null,null,null,null,null,null,null,null,null,null,null,null,null,null,null,null,null,null,null,null,null,null,null,null,null,null,null,null,null,null,null,null,null,null,null,null,null,null,null,null,null,null,null,null,null,null,null,null,null,null,null,null,null,null,null,null,null,null,null,null,null,null,null,null,null,null,null,null,null,null,null,null,null,null,null,null,null,null,null,null,null,null,null,null,null,null,null,null,null,null,null,null,null,null,null,null,null,null,null,null,null,null,null,null,null,null,null,null,null,null,null,null,null,null,null,null,null,null,null,null,null,null,null,null,null,null,null,null,null,null,null,null,null,null,null,null,null,null,null,null,null,null,null,null,null,null,null,null,null,null,null,null,null,null,null,null,null,null,null,null,null,null,null,null,null,null,null,null,null,null,null,null,null,null,null,null,null,null,null,null,null,null,null,null,null,null,null,null,null,null,null,null,null,null,null,null,null,null,null,null,null,null,null,null,null,null,null,null,null,null,null,null,null,null,null,null,null,null,null,null,null,null,null,null,null,null,null,null,null,null,null,null,null,null,null,null,null,null,null,null,null,null,null,null,null,null,null,null,null,null,null,null,null,null,null,null,null,null,null,null,null,null,null,null,null,null,null,null,null,null,null,null,null,null,null,null,null,null,null,null,null,null,null,null,null,null,null,null,null,null,null,null,null,null,null,null,null,null,null,null,null,null,null,null,null,null,null,null,null,null,null,null,null,null,null,null,null,null,null,null,null,null,null,null,null,null,null,null,null,null,null,null,null,null,null,null,null,null,null,null,null,null,null,null,null,null,null,null,null,null,null,null,null,null,null,null,null,null,null,null,null,null,null,null,null,null,null,null,null,null,null,null,null,null,null,null,null,null,null,null,null,null,null,null,null,null,null,null,null,null,null,null,null,null,null,null,null,null,null,null,null,null,null,null,null,null,null,null,null,null,null,null,null,null,null,null,null,null,null,null,null,null,null,null,null,null,null,null,null,null,null,null,null,null,null,null,null,null,null,null,null,null,null,null,null,null,null,null,null,null,null,null,null,null,null,null,null,null,null,null,null,null,null,null,null,null,null,null,null,null,null,null,null,null,null,null,null,null,null,null,null,null,null,null,null,null,null,null,null,null,null,null,null,null,null]}}}